,S. No.,Message_body,Label
0,1.0,Rofl. Its true to its name,Non-Spam
1,2.0,The guy did some bitching but I acted like i'd be interested in buying something else next week and he gave it to us for free,Non-Spam
2,3.0,"Pity, * was in mood for that. So...any other suggestions?",Non-Spam
3,4.0,Will ü b going to esplanade fr home?,Non-Spam
6,7.0,Huh y lei...,Non-Spam
7,8.0,Why don't you wait 'til at least wednesday to see if you get your .,Non-Spam
8,9.0,Ard 6 like dat lor.,Non-Spam
9,10.0,Ok lor... Sony ericsson salesman... I ask shuhui then she say quite gd 2 use so i considering...,Non-Spam
10,11.0,Get me out of this dump heap. My mom decided to come to lowes. BORING.,Non-Spam
11,12.0,Anything lor. Juz both of us lor.,Non-Spam
12,13.0,if you aren't here in the next  &lt;#&gt;  hours imma flip my shit,Non-Spam
13,14.0,"Sorry, I'll call later",Non-Spam
14,15.0,No. I meant the calculation is the same. That  &lt;#&gt; units at  &lt;#&gt; . This school is really expensive. Have you started practicing your accent. Because its important. And have you decided if you are doing 4years of dental school or if you'll just do the nmde exam.,Non-Spam
15,16.0,Yes i have. So that's why u texted. Pshew...missing you so much,Non-Spam
16,17.0,Yeh. Indians was nice. Tho it did kane me off a bit he he. We shud go out 4 a drink sometime soon. Mite hav 2 go 2 da works 4 a laugh soon. Love Pete x x,Non-Spam
17,18.0,Well keep in mind I've only got enough gas for one more round trip barring a sudden influx of cash,Non-Spam
18,19.0,Hahaha..use your brain dear,Non-Spam
19,20.0,Have a safe trip to Nigeria. Wish you happiness and very soon company to share moments with,Non-Spam
20,21.0,Wen did you get so spiritual and deep. That's great,Non-Spam
21,22.0,"Cool, what time you think you can get here?",Non-Spam
22,23.0,"You know, wot people wear. T shirts, jumpers, hat, belt, is all we know. We r at Cribbs",Non-Spam
23,24.0,"No, I was trying it all weekend ;V",Non-Spam
24,25.0,Ic. There are a lotta childporn cars then.,Non-Spam
25,26.0,Hi its in durban are you still on this number,Non-Spam
26,27.0,"I'm taking derek &amp; taylor to walmart, if I'm not back by the time you're done just leave the mouse on my desk and I'll text you when priscilla's ready",Non-Spam
27,28.0,U still havent got urself a jacket ah?,Non-Spam
28,29.0,Armand says get your ass over to epsilon,Non-Spam
29,30.0,Yeah it's jus rite...,Non-Spam
31,32.0,Just sleeping..and surfing,Non-Spam
32,33.0,I can't believe how attached I am to seeing you every day. I know you will do the best you can to get to me babe. I will go to teach my class at your midnight,Non-Spam
34,35.0,Aiyah ok wat as long as got improve can already wat...,Non-Spam
35,36.0,"I know you are thinkin malaria. But relax, children cant handle malaria. She would have been worse and its gastroenteritis. If she takes enough to replace her loss her temp will reduce. And if you give her malaria meds now she will just vomit. Its a self limiting illness she has which means in a few days it will completely stop",Non-Spam
36,37.0,Ok which your another number,Non-Spam
37,38.0,"Hey chief, can you give me a bell when you get this. Need to talk to you about this royal visit on the 1st june. ",Non-Spam
38,39.0,happened here while you were adventuring,Non-Spam
39,40.0,Compliments to you. Was away from the system. How your side.,Non-Spam
40,41.0,I think that tantrum's finished so yeah I'll be by at some point,Non-Spam
41,42.0,What about this one then.,Non-Spam
42,43.0,Its just the effect of irritation. Just ignore it,Non-Spam
43,44.0,"Total disappointment, when I texted you was the craziest shit got :(",Non-Spam
45,46.0,I want to tell you how bad I feel that basically the only times I text you lately are when I need drugs,Non-Spam
47,48.0,Going to join tomorrow.,Non-Spam
48,49.0,Thats cool. I want to please you...,Non-Spam
49,50.0,You are a big chic. Common. Declare,Non-Spam
50,51.0,No. I dont want to hear anything,Non-Spam
51,52.0,Can you pls send me that company name. In saibaba colany,Non-Spam
52,53.0,"By the way, i've put a skip right outside the front of the house so you can see which house it is. Just pull up before it.",Non-Spam
53,54.0,Miles and smiles r made frm same letters but do u know d difference..? smile on ur face keeps me happy even though I am miles away from u.. :-)keep smiling.. Good nyt,Non-Spam
54,55.0,"Ya, i'm referin to mei's ex wat... No ah, waitin 4 u to treat, somebody shld b rich liao...So gd, den u dun have to work frm tmr onwards...",Non-Spam
55,56.0,You are a great role model. You are giving so much and i really wish each day for a miracle but God as a reason for everything and i must say i wish i knew why but i dont. I've looked up to you since i was young and i still do. Have a great day.,Non-Spam
56,57.0,Oh... Okie lor...We go on sat... ,Non-Spam
57,58.0,Yes. Please leave at  &lt;#&gt; . So that at  &lt;#&gt;  we can leave,Non-Spam
58,59.0,"Just making dinner, you ?",Non-Spam
59,60.0,"It‘s reassuring, in this crazy world.",Non-Spam
60,61.0,I went to project centre,Non-Spam
61,62.0,Lol they were mad at first but then they woke up and gave in.,Non-Spam
62,63.0,"Machan you go to gym tomorrow,  i wil come late goodnight.",Non-Spam
63,64.0,I want to be inside you every night...,Non-Spam
64,65.0,God's love has no limit. God's grace has no measure. God's power has no boundaries. May u have God's endless blessings always in ur life...!! Gud ni8,Non-Spam
65,66.0,What i told before i tell. Stupid hear after i wont tell anything to you. You dad called to my brother and spoken. Not with me.,Non-Spam
66,67.0,Wait . I will msg after  &lt;#&gt;  min.,Non-Spam
67,68.0,"Perhaps * is much easy give your account identification, so i will tomorrow at UNI",Non-Spam
68,69.0,Apo all other are mokka players only,Non-Spam
70,71.0,Love has one law; Make happy the person you love. In the same way friendship has one law; Never make ur friend feel alone until you are alive.... Gud night,Non-Spam
71,72.0,Now get step 2 outta the way. Congrats again.,Non-Spam
72,73.0,Why did I wake up on my own &gt;:(,Non-Spam
74,75.0,Yes... I trust u to buy new stuff ASAP so I can try it out,Non-Spam
75,76.0,"Good afternoon, my love ... How goes your day ? How did you sleep ? I hope your well, my boytoy ... I think of you ...",Non-Spam
76,77.0,"Cool, we shall go and see, have to go to tip anyway. Are you at home, got something to drop in later? So lets go to town tonight! Maybe mum can take us in.",Non-Spam
77,78.0,I think if he rule tamilnadu..then its very tough for our people.,Non-Spam
79,80.0,U studying in sch or going home? Anyway i'll b going 2 sch later.,Non-Spam
80,81.0,K. I will sent it again,Non-Spam
81,82.0,Oh thanks a lot..i already bought 2 eggs ..,Non-Spam
82,83.0,K. I will sent it again,Non-Spam
84,85.0,Ofcourse I also upload some songs,Non-Spam
85,86.0,Also fuck you and your family for going to rhode island or wherever the fuck and leaving me all alone the week I have a new bong &gt;:(,Non-Spam
86,87.0,", ,  and  picking them up from various points | going 2 yeovil | and they will do the motor project 4 3 hours | and then u take them home. || 12 2 5.30 max. || Very easy",Non-Spam
87,88.0,So li hai... Me bored now da lecturer repeating last weeks stuff waste time... ,Non-Spam
89,90.0,Shall call now dear having food,Non-Spam
90,91.0,Have you seen who's back at Holby?!,Non-Spam
91,92.0,Really do hope the work doesnt get stressful. Have a gr8 day.,Non-Spam
92,93.0,No probably  &lt;#&gt; %.,Non-Spam
93,94.0,What Today-sunday..sunday is holiday..so no work..,Non-Spam
94,95.0,Yes princess! I want to please you every night. Your wish is my command...,Non-Spam
95,96.0,Dhoni have luck to win some big title.so we will win:),Non-Spam
96,97.0,Where's mummy's boy ? Is he being good or bad ? Is he being positive or negative ? Why is mummy being made to wait? Hmmmm?,Non-Spam
97,98.0,Ok lor ü reaching then message me.,Non-Spam
98,99.0,Well obviously not because all the people in my cool college life went home ;_;,Non-Spam
99,100.0,Yup,Non-Spam
100,101.0,I thought slide is enough.,Non-Spam
101,102.0,Ok lor.,Non-Spam
105,106.0,Shall I bring us a bottle of wine to keep us amused? Only joking! I‘ll bring one anyway,Non-Spam
106,107.0,I will treasure every moment we spend together...,Non-Spam
107,108.0,U GOIN OUT 2NITE?,Non-Spam
109,110.0,Ok i thk i got it. Then u wan me 2 come now or wat?,Non-Spam
111,112.0,If you hear a loud scream in about &lt;#&gt; minutes its cause my Gyno will be shoving things up me that don't belong :/,Non-Spam
112,113.0,"Sorry, I'll call later",Non-Spam
113,114.0,Arun can u transfr me d amt,Non-Spam
115,116.0,Wishing you a beautiful day. Each moment revealing even more things to keep you smiling. Do enjoy it.,Non-Spam
116,117.0,Im just wondering what your doing right now?,Non-Spam
117,118.0,Except theres a chick with huge boobs.,Non-Spam
118,119.0,What???? Hello wats talks email address?,Non-Spam
119,120.0,Just sing HU. I think its also important to find someone female that know the place well preferably a citizen that is also smart to help you navigate through. Even things like choosing a phone plan require guidance. When in doubt ask especially girls.,Non-Spam
120,121.0,Sac needs to carry on:),Non-Spam
122,123.0,"aight we can pick some up, you open before tonight?",Non-Spam
123,124.0,So that takes away some money worries,Non-Spam
124,125.0,I am back. Good journey! Let me know if you need any of the receipts. Shall i tell you like the pendent?,Non-Spam
125,126.0,"And that's fine, I got enough bud to last most of the night at least",Non-Spam
126,127.0,Good morning. At the repair shop--the ONLY reason i'm up at this hour.,Non-Spam
128,129.0,"I thought i'd get him a watch, just cos thats the kind of thing u get4an18th. And he loves so much!",Non-Spam
129,130.0,"By the way, make sure u get train to worc foregate street not shrub hill. Have fun night x",Non-Spam
130,131.0,Thank you. do you generally date the brothas?,Non-Spam
131,132.0,Hey i've booked the 2 lessons on sun liao...,Non-Spam
132,133.0,What are youdoing later? Sar xxx,Non-Spam
133,134.0,Am slow in using biola's fne,Non-Spam
134,135.0,Mode men or have you left.,Non-Spam
135,136.0,I'm wif him now buying tix lar...,Non-Spam
136,137.0,Jesus armand really is trying to tell everybody he can find,Non-Spam
137,138.0,You're gonna have to be way more specific than that,Non-Spam
138,139.0,Thanx a lot 4 ur help!,Non-Spam
139,140.0,If I was I wasn't paying attention,Non-Spam
140,141.0,"If you can make it any time tonight or whenever you can it's cool, just text me whenever you're around",Non-Spam
141,142.0,"Er yeah, i will b there at 15:26, sorry! Just tell me which pub/cafe to sit in and come wen u can",Non-Spam
142,143.0,You didnt complete your gist oh.,Non-Spam
144,145.0,Oh yeah! And my diet just flew out the window,Non-Spam
145,146.0,Otherwise had part time job na-tuition..,Non-Spam
146,147.0,U horrible gal... U knew dat i was going out wif him yest n u still come n ask me...,Non-Spam
147,148.0,"Sorry, I'll call later",Non-Spam
148,149.0,Ok k..sry i knw 2 siva..tats y i askd..,Non-Spam
149,150.0,"Hi elaine, is today's meeting confirmed?",Non-Spam
150,151.0,I dont know oh. Hopefully this month.,Non-Spam
151,152.0,I'm at bruce &amp; fowler now but I'm in my mom's car so I can't park (long story),Non-Spam
152,153.0,So how are you really. What are you up to. How's the masters. And so on.,Non-Spam
153,154.0,Nope. I just forgot. Will show next week,Non-Spam
154,155.0,My slave! I want you to take 2 or 3 pictures of yourself today in bright light on your cell phone! Bright light!,Non-Spam
155,156.0,You should get more chicken broth if you want ramen unless there's some I don't know about,Non-Spam
156,157.0,East coast,Non-Spam
157,158.0,Nite nite pocay wocay luv u more than n e thing 4eva I promise ring u 2morrowxxxx,Non-Spam
158,159.0,Gr8. So how do you handle the victoria island traffic. Plus when's the album due,Non-Spam
159,160.0,I ask if u meeting da ge tmr nite...,Non-Spam
160,161.0,"Daddy, shu shu is looking 4 u... U wan me 2 tell him u're not in singapore or wat?",Non-Spam
161,162.0,There is a first time for everything :),Non-Spam
162,163.0,... Are you in the pub?,Non-Spam
163,164.0,Yup he msg me: is tat yijue? Then i tot it's my group mate cos we meeting today mah... I'm askin if ü leaving earlier or wat mah cos mayb ü haf to walk v far...,Non-Spam
164,165.0,Dear are you angry i was busy dear,Non-Spam
165,166.0,So how many days since then?,Non-Spam
166,167.0,Pls give her prometazine syrup. 5mls then  &lt;#&gt; mins later feed.,Non-Spam
167,168.0,So gd got free ice cream... I oso wan...,Non-Spam
168,169.0,Hi babe its me thanks for coming even though it didnt go that well!i just wanted my bed! Hope to see you soon love and kisses xxx,Non-Spam
169,170.0,Babes I think I got ur brolly I left it in English wil bring it in 2mrw 4 u luv Franxx,Non-Spam
170,171.0,HARD BUT TRUE: How much you show &amp;  express your love to someone....that much it will hurt when they leave you or you get seperated...!?????ud evening...,Non-Spam
171,172.0,And he's apparently bffs with carly quick now,Non-Spam
172,173.0,Hi. Hope you had a good day. Have a better night.,Non-Spam
173,174.0,That's necessarily respectful,Non-Spam
174,175.0,As in i want custom officer discount oh.,Non-Spam
175,176.0,Dunno lei shd b driving lor cos i go sch 1 hr oni.,Non-Spam
176,177.0,I dont know exactly could you ask chechi.,Non-Spam
177,178.0,"All done, all handed in. Don't know if mega shop in asda counts as celebration but thats what i'm doing!",Non-Spam
178,179.0,Ooooooh I forgot to tell u I can get on yoville on my phone,Non-Spam
179,180.0,Watching ajith film ah?,Non-Spam
180,181.0,Nt joking seriously i told,Non-Spam
181,182.0,Ok.ok ok..then..whats ur todays plan,Non-Spam
182,183.0,NOT MUCH NO FIGHTS. IT WAS A GOOD NITE!!,Non-Spam
183,184.0,I will be gentle baby! Soon you will be taking all  &lt;#&gt;  inches deep inside your tight pussy...,Non-Spam
184,185.0,I'm at work. Please call,Non-Spam
185,186.0,How do friends help us in problems? They give the most stupid suggestion that Lands us into another problem and helps us forgt the previous problem,Non-Spam
186,187.0,How are you babes. Hope your doing ok. I had a shit nights sleep. I fell asleep at 5.I’m knackered and i’m dreading work tonight. What are thou upto tonight. X,Non-Spam
187,188.0,Good day to You too.Pray for me.Remove the teeth as its painful maintaining other stuff.,Non-Spam
188,189.0,"I can make it up there, squeezed  &lt;#&gt;  bucks out of my dad",Non-Spam
190,191.0,Its sunny in california. The weather's just cool,Non-Spam
191,192.0,Somebody set up a website where you can play hold em using eve online spacebucks,Non-Spam
194,195.0,I don't want you to leave. But i'm barely doing what i can to stay sane. fighting with you constantly isn't helping.,Non-Spam
195,196.0,I cant pick the phone right now. Pls send a message,Non-Spam
196,197.0,Do u konw waht is rael FRIENDSHIP Im gving yuo an exmpel: Jsut ese tihs msg.. Evrey splleing of tihs msg is wrnog.. Bt sitll yuo can raed it wihtuot ayn mitsake.. GOODNIGHT &amp; HAVE A NICE SLEEP..SWEET DREAMS..,Non-Spam
197,198.0,"K I'll head out in a few mins, see you there",Non-Spam
198,199.0,"Ok., is any problem to u frm him? Wats matter?",Non-Spam
199,200.0,"Lol, oh you got a friend for the dog ?",Non-Spam
201,202.0,Hi mom we might be back later than  &lt;#&gt; ,Non-Spam
203,204.0,Just trying to figure out when I'm suppose to see a couple different people this week. We said we'd get together but I didn't set dates,Non-Spam
206,207.0,"I think your mentor is , but not 100 percent sure.",Non-Spam
207,208.0,I'm in inside office..still filling forms.don know when they leave me.,Non-Spam
208,209.0,Yep get with the program. You're slacking.,Non-Spam
209,210.0,"Hey, iouri gave me your number, I'm wylie, ryan's friend",Non-Spam
210,211.0,This is ur face test ( 1 2 3 4 5 6 7 8 9  &lt;#&gt;  ) select any number i will tell ur face astrology.... am waiting. quick reply...,Non-Spam
211,212.0,Hmm. Shall i bring a bottle of wine to keep us amused? Just joking! I'll still bring a bottle. Red or white? See you tomorrow,Non-Spam
212,213.0,Ok,Non-Spam
213,214.0,Tell me something. Thats okay.,Non-Spam
214,215.0,"Living is very simple.. Loving is also simple.. Laughing is too simple.. Winning is tooo simple.. But, Being 'SIMPLE' is very difficult...;-) :-)",Non-Spam
215,216.0,Aiyo cos i sms ü then ü neva reply so i wait 4 ü to reply lar. I tot ü havent finish ur lab wat.,Non-Spam
216,217.0,Guai... Ü shd haf seen him when he's naughty... Ü so free today? Can go jogging...,Non-Spam
217,218.0,Good morning princess! Have a great day!,Non-Spam
218,219.0,Yup it's at paragon... I havent decided whether 2 cut yet... Hee...,Non-Spam
219,220.0,No one interested. May be some business plan.,Non-Spam
220,221.0,I'm home...,Non-Spam
221,222.0,Do I? I thought I put it back in the box,Non-Spam
222,223.0,No sir. That's why i had an 8-hr trip on the bus last week. Have another audition next wednesday but i think i might drive this time.,Non-Spam
223,224.0,"My Parents, My Kidz, My Friends n My Colleagues. All screaming.. SURPRISE !! and I was waiting on the sofa.. ... ..... ' NAKED...!",Non-Spam
224,225.0,Wat ü doing now?,Non-Spam
225,226.0,When you guys planning on coming over?,Non-Spam
226,227.0,No go. No openings for that room 'til after thanksgiving without an upcharge.,Non-Spam
228,229.0,And of course you should make a stink!,Non-Spam
229,230.0,Are u awake? Is there snow there?,Non-Spam
230,231.0,You'd like that wouldn't you? Jerk!,Non-Spam
231,232.0,So when do you wanna gym?,Non-Spam
232,233.0,My birthday is on feb  &lt;#&gt;  da. .,Non-Spam
233,234.0,Sounds better than my evening im just doing my costume. Im not sure what time i finish tomorrow but i will txt you at the end.,Non-Spam
234,235.0,No. It's not pride. I'm almost  &lt;#&gt;  years old and shouldn't be takin money from my kid. You're not supposed to have to deal with this stuff. This is grownup stuff--why i don't tell you.,Non-Spam
235,236.0,"Garbage bags, eggs, jam, bread, hannaford wheat chex",Non-Spam
236,237.0,"Neither [in sterm voice] - i'm studying. All fine with me! Not sure the  thing will be resolved, tho. Anyway. Have a fab hols",Non-Spam
237,238.0,I think steyn surely get one wicket:),Non-Spam
238,239.0,X course it 2yrs. Just so her messages on messenger lik you r sending me,Non-Spam
239,240.0,Dude im no longer a pisces. Im an aquarius now.,Non-Spam
240,241.0,"Sir, waiting for your letter.",Non-Spam
241,242.0,Sweet heart how are you?,Non-Spam
242,243.0,Wishing you a wonderful week.,Non-Spam
243,244.0,What makes you most happy?,Non-Spam
244,245.0,"Gal n boy walking in d park. gal-can i hold ur hand? boy-y? do u think i would run away? gal-no, jst wana c how it feels walking in heaven with an prince..GN:-)",Non-Spam
245,246.0,"Dear Sir,Salam Alaikkum.Pride and Pleasure meeting you today at the Tea Shop.We are pleased to send you our contact number at Qatar.Rakhesh an Indian.Pls save our Number.Respectful Regards.",Non-Spam
246,247.0,Aah bless! How's your arm?,Non-Spam
247,248.0,"Thanks, I'll keep that in mind",Non-Spam
248,249.0,Ok no problem... Yup i'm going to sch at 4 if i rem correctly...,Non-Spam
249,250.0,But we havent got da topic yet rite?,Non-Spam
250,251.0,Kothi print out marandratha.,Non-Spam
251,252.0,"Good morning, my Love ... I go to sleep now and wish you a great day full of feeling better and opportunity ... You are my last thought babe, I LOVE YOU *kiss*",Non-Spam
252,253.0,"K, fyi I'm back in my parents' place in south tampa so I might need to do the deal somewhere else",Non-Spam
253,254.0,Jus finish watching tv... U?,Non-Spam
254,255.0,Hahaha..use your brain dear,Non-Spam
256,257.0,My sister going to earn more than me da.,Non-Spam
257,258.0,Here got ur favorite oyster... N got my favorite sashimi... Ok lar i dun say already... Wait ur stomach start rumbling...,Non-Spam
258,259.0,K.k:)i'm going to tirunelvali this week to see my uncle ..i already spend the amount by taking dress .so only i want money.i will give it on feb 1,Non-Spam
259,260.0,"yeah, that's what I was thinking",Non-Spam
260,261.0,"Jolly good! By the way,  will give u tickets for sat eve 7.30. Speak before then x",Non-Spam
261,262.0,I'm coming back on Thursday. Yay. Is it gonna be ok to get the money. Cheers. Oh yeah and how are you. Everything alright. Hows school. Or do you call it work now,Non-Spam
262,263.0,What you did in  leave.,Non-Spam
263,264.0,Ill be at yours in about 3 mins but look out for me,Non-Spam
264,265.0,Hi missed your Call and my mumHas beendropping red wine all over theplace! what is your adress?,Non-Spam
265,266.0,Pls ask macho how much is budget for bb bold 2 is cos i saw a new one for  &lt;#&gt;  dollars.,Non-Spam
266,267.0,"I can. But it will tell quite long, cos i haven't finish my film yet...",Non-Spam
267,268.0,About  &lt;#&gt; bucks. The banks fees are fixed. Better to call the bank and find out.,Non-Spam
268,269.0,At WHAT TIME should i come tomorrow,Non-Spam
269,270.0,I can't make it tonight,Non-Spam
270,271.0,Well good morning mr . Hows london treatin' ya treacle?,Non-Spam
271,272.0,I.ll hand her my phone to chat wit u,Non-Spam
272,273.0,My darling sister. How are you doing. When's school resuming. Is there a minimum wait period before you reapply? Do take care,Non-Spam
273,274.0,Are u coming to the funeral home,Non-Spam
274,275.0,Alex says he's not ok with you not being ok with it,Non-Spam
276,277.0,I donno its in your genes or something,Non-Spam
278,279.0,Xy trying smth now. U eat already? We havent...,Non-Spam
279,280.0,Dear where you. Call me,Non-Spam
280,281.0,Hey! Congrats 2u2. id luv 2 but ive had 2 go home!,Non-Spam
281,282.0,An excellent thought by a misundrstud frnd: I knw u hate me bt the day wen u'll knw the truth u'll hate urself:-( Gn:-),Non-Spam
282,283.0,Hey ! Don't forget ... You are MINE ... For ME ... My possession ... MY property ... MMM ... *childish smile* ...,Non-Spam
283,284.0,I'm still pretty weak today .. Bad day ?,Non-Spam
285,286.0,Sent me ur email id soon,Non-Spam
286,287.0,"Yeah, probably here for a while",Non-Spam
287,288.0,I have gone into get info bt dont know what to do,Non-Spam
288,289.0,"And how you will do that, princess? :)",Non-Spam
289,290.0,"Vikky, come around  &lt;TIME&gt; ..",Non-Spam
290,291.0,"Helloooo... Wake up..! ""Sweet"" ""morning"" ""welcomes"" ""You"" ""Enjoy"" ""This Day"" ""with full of joy"".. ""GUD MRNG"".",Non-Spam
292,293.0,"Best msg: It's hard to be with a person, when u know that one more step foward will make u fall in love.. &amp; One step back can ruin ur friendship.. good night:-) ...",Non-Spam
293,294.0,Dunno leh cant remember mayb lor. So wat time r we meeting tmr?,Non-Spam
294,295.0,Oh yeah clearly it's my fault,Non-Spam
295,296.0,"Hi. Hope ur day * good! Back from walk, table booked for half eight. Let me know when ur coming over.",Non-Spam
296,297.0,Its too late:)but its k.wish you the same.,Non-Spam
297,298.0,"Hello.How u doing?What u been up 2?When will u b moving out of the flat, cos I will need to arrange to pick up the lamp, etc. Take care. Hello caroline!",Non-Spam
298,299.0,So u wan 2 come for our dinner tonight a not?,Non-Spam
299,300.0,Did u fix the teeth?if not do it asap.ok take care.,Non-Spam
301,302.0,"ER, ENJOYIN INDIANS AT THE MO..yeP. SaLL gOoD HehE ;> hows bout u shexy? Pete Xx",Non-Spam
302,303.0,Anything lar then ü not going home 4 dinner?,Non-Spam
303,304.0,HI DARLIN ITS KATE ARE U UP FOR DOIN SOMETHIN TONIGHT? IM GOING TO A PUB CALLED THE SWAN OR SOMETHING WITH MY PARENTS FOR ONE DRINK SO PHONE ME IF U CAN,Non-Spam
304,305.0,Gud ni8.swt drms.take care,Non-Spam
305,306.0,"Storming msg: Wen u lift d phne, u say ""HELLO"" Do u knw wt is d real meaning of HELLO?? . . . It's d name of a girl..! . . . Yes.. And u knw who is dat girl?? ""Margaret Hello"" She is d girlfrnd f Grahmbell who invnted telphone... . . . . Moral:One can 4get d name of a person, bt not his girlfrnd... G o o d n i g h t . . .@",Non-Spam
306,307.0,Pls speak with me. I wont ask anything other then you friendship.,Non-Spam
307,308.0,Did you see that film:),Non-Spam
308,309.0,I absolutely LOVE South Park! I only recently started watching the office.,Non-Spam
309,310.0,If anyone calls for a treadmill say you'll buy it. Make sure its working. I found an ad on Craigslist selling for $ &lt;#&gt; .,Non-Spam
310,311.0,Can help u swoop by picking u up from wherever ur other birds r meeting if u want.,Non-Spam
311,312.0,1 in cbe. 2 in chennai.,Non-Spam
312,313.0,"As usual..iam fine, happy &amp; doing well..:)",Non-Spam
313,314.0,Well she's in for a big surprise!,Non-Spam
314,315.0,Ok... Sweet dreams...,Non-Spam
315,316.0,I didnt get anything da,Non-Spam
316,317.0,Please tell me not all of my car keys are in your purse,Non-Spam
317,318.0,You do your studies alone without anyones help. If you cant no need to study.,Non-Spam
318,319.0,"Yeah work is fine, started last week, all the same stuff as before, dull but easy and guys are fun!",Non-Spam
320,321.0,"K I'm leaving soon, be there a little after 9",Non-Spam
321,322.0,U come n search tat vid..not finishd..,Non-Spam
322,323.0,Gud ni8 dear..slp well..take care..swt dreams..Muah..,Non-Spam
323,324.0,Haven't eaten all day. I'm sitting here staring at this juicy pizza and I can't eat it. These meds are ruining my life.,Non-Spam
324,325.0,Thank you princess! I want to see your nice juicy booty...,Non-Spam
325,326.0,thanks for the temales it was wonderful. Thank. Have a great week.,Non-Spam
326,327.0,Of course ! Don't tease me ... You know I simply must see ! *grins* ... Do keep me posted my prey ... *loving smile* *devouring kiss*,Non-Spam
327,328.0,Hmm thinking lor...,Non-Spam
328,329.0,Its a part of checking IQ,Non-Spam
329,330.0,"Gud gud..k, chikku tke care.. sleep well gud nyt",Non-Spam
330,331.0,"Jay wants to work out first, how's 4 sound?",Non-Spam
